<!ELEMENT students (student,student,teachers)>
<!ELEMENT student (id,name,age)>
<!ELEMENT id (#PCDATA)>
<!ELEMENT name (#PCDATA)>
<!ELEMENT age (#PCDATA)>
<!ELEMENT teachers (teacher)>
<!ELEMENT teacher (id,name,age)>
